국가,대학명,지원가능 전공(SKKU),해외대학 수학 전공,최소 GPA,완료 학기 수,최소 학점,최대 학점,위치(도심 거리),수업 언어,어학 요건,특징,출처 요약,참고 링크,문의 이메일
FRANCE,ECE Paris,모든 전공,"모든 학과 개방(Artificial Intelligence, Data Management, Cybersecurity, Embedded Systems, Energy & Environment 등)",담당자 이메일 문의,프로그램별 상이,10 ECTS,제한 없음,준도시 — 파리 도심까지 지하철 약 20분,영어,IELTS 6.0점 이상 또는 TOEFL iBT 83점 이상 또는 TOEIC 780점 이상 (영어과정); 프랑스어과정은 CEFR B2,교내 기숙사 미보장·조기신청 필요 · 미식과 카페 문화로 유명한 도시 · 유럽 한복판이라 주말 배낭여행 거점으로 최적,GPA:이메일문의 · 어학:웹 · 수업언어:웹 · 전공:웹 · 위치:AI추정,https://www.ece.fr/en/international-en/,international@ece.fr
GERMANY,University of Wuppertal,자연과학대학,교환학생 수용하는 모든 학과 개방,담당자 이메일 문의,2학기 이상,확인필요,확인필요,준도시 — 부퍼탈 도심까지 기차 약 15분,"독일어, 영어",담당자 이메일 문의,교환학생 기숙사 일부 보장·조기신청 필요 · 유럽 내 접근성 좋은 교통 허브 도시 · 자연과 도시가 조화된 산악 지형 경관 · 독일 전통 시장과 현대적 문화 공존,GPA:이메일문의 · 어학:이메일문의 · 수업언어:factsheet · 전공:시트 · 위치:AI추정,https://www.uni-wuppertal.de/fileadmin/data/bu/Internationales/IntSek/Gast-_und_Austauschstudium/Erasmus__/Fact_Sheet_for_Exchange_Students.pdf,myfey@uni-wuppertal.de
GERMANY,University of Mannheim,모든 전공,대부분 학부 개방(경영 제외),담당자 이메일 문의,2학기 이상,명시 없음,제한 없음,도시 — 만하임 도심에 위치,"독일어, 영어",영어 또는 독일어 CEFR B2 (증빙 불요),라인강변 산책로·강가 카페 문화 · 독일 남서부 교통 허브로 유럽 여행 편리 · 바덴뷔르템베르크 주 경제 중심지,GPA:이메일문의 · 어학:시트 · 수업언어:시트 · 전공:시트 · 위치:AI추정,,incomings@uni-mannheim.de
GERMANY,Ruhr University of Bochum,모든 전공,교환학생 수용하는 모든 학과 개방,제한 없음/명시 없음,명시 없음,명시 없음,제한 없음,도시 — 보훔 도심에 위치,"독일어, 영어",학과별 상이 (통상 영어 CEFR B2 — TOEFL iBT 72점·IELTS 5.5점 상당),루르 공업지대 중심 도시 산업 현장 체험 기회 · 독일 전통 맥주 문화 체험 가능한 도시,GPA:시트 · 어학:웹 · 수업언어:시트 · 전공:시트 · 위치:AI추정,https://international.ruhr-uni-bochum.de/en/international-exchange-students,rubiss@ruhr-uni-bochum.de
GERMANY,CBS International Business School,경영대학,"Business-, Management-, Information Systems-, or Engineering-related field",제한 없음/명시 없음,2학기 이상 (경영·IT·공학 관련 전공),18 ECTS,30 ECTS,준도시 — 쾰른 도심까지 지하철 약 15분,영어,TOEFL iBT 83점 이상 또는 IELTS 6.5점 이상 (CEFR B2 상당),라인 강변 산책로·강변 카페 문화 · 쾰른 대성당·역사적 명소 접근성 · 유럽 주요 도시 간 교통 허브,GPA:시트 · 어학:시트 · 수업언어:웹 · 전공:시트 · 위치:AI추정,https://www.cbs.de/en/international/certificate-programmes,international.office@cbs.de
GERMANY,University of Rostock,모든 전공,"교환학생 수용하는 모든 학과 개방 (Human Medicine, Dentistry, Medical Biotechnology 제외 시 B2 요구)",담당자 이메일 문의,1학기 이상,명시 없음,제한 없음,도시 — 로스토크 도심에 위치,"독일어, 영어",독일어 CEFR B1 이상·영어 B1 이상 (의학계열은 독일어 B2),기숙사 신청 필수·조기신청 필요 · 발트해 접한 항구 도시 휴양지 분위기 · 북독일 전통 건축물과 현대적 캠퍼스 조화,GPA:이메일문의 · 어학:시트 · 수업언어:시트 · 전공:시트 · 위치:AI추정,https://www.uni-rostock.de/en/international-affairs/incoming/gueststudies-erasmus/,incoming.io@uni-rostock.de
GERMANY,Chemnitz University of Technology,정보통신대학,교환학생 수용하는 모든 학과,제한 없음/명시 없음,2학기 이상,15 ECTS,30 ECTS,준도시 — 소도시 켐니츠 시내 (라이프치히에서 기차 약 40분),"독일어, 영어",공인성적 불요 (영어 B2 강력 권장),라이프치히 접근성 좋은 유럽 배낭여행 거점 · 공학 특화 대학도시 고즈넉한 분위기,GPA:시트 · 어학:시트 · 수업언어:웹 · 전공:시트 · 위치:AI추정,https://www.tu-chemnitz.de/international/incoming/erasmus/index.php.en,nadja.hueller@iuz.tu-chemnitz.de
GERMANY,Leuphana University Luneburg,모든 전공,교환학생 수용하는 모든 학과,담당자 이메일 문의,제한 없음,명시 없음 (통상 30 ECTS),명시 없음 (모듈당 5 ECTS),준도시 — 소도시 뤼네부르크 시내 (함부르크에서 기차 약 50분),"독일어, 영어",영어 CEFR B2 이상 (TOEFL iBT 72점·IELTS 5.0점·TOEIC L&R 785점 상당),중세 도시 풍경과 현대적 캠퍼스 조화 · 함부르크 접근성 좋은 소도시 생활 · 북독일 전통 음식과 카페 문화,GPA:이메일문의 · 어학:웹 · 수업언어:웹 · 전공:시트 · 위치:AI추정,Studying at Leuphana | Leuphana,kirja.frommeyer@leuphana.de
GERMANY,Goethe University Frankfurt,문과대학,교환학생 수용하는 모든 학과,담당자 이메일 문의,2학기 이상,명시 없음,제한 없음,준도시 — 프랑크푸르트암마인 도심까지 지하철 약 15분,"독일어, 영어",독일어 CEFR B1 이상,유럽 금융 중심지 인턴십 기회 풍부 · 프랑크푸르트 학파 사회과학 명성 · 마인 강변 산책로·근교 자연경관,GPA:이메일문의 · 어학:시트 · 수업언어:웹 · 전공:시트 · 위치:AI추정,https://www.uni-frankfurt.de/122909823/Incoming_Guest_students_and_Internships_at_Goethe_University?locale=en,incoming@uni-frankfurt.de
GERMANY,University of Cologne,경영대학,교환학생 수용하는 모든 학과,제한 없음/명시 없음,3학기 이상,명시 없음,명시 없음 (통상 30 ECTS/5과목),도시 — 쾰른 도심에 위치,"독일어, 영어",영어 CEFR B2 이상,라인 강변 낭만적인 도시 풍경 · 쾰른 대성당 등 역사적 명소 접근성 · 유럽 내 교통 허브로 주말 여행 편리,GPA:시트 · 어학:시트 · 수업언어:웹 · 전공:시트 · 위치:AI추정,https://wiso.uni-koeln.de/de/studium/international/incoming-exchange-at-wiso/semester-exchange,incomings@wiso.uni-koeln.de
GERMANY,Kiel University,모든 전공,교환학생 수용하는 모든 학과 개방,제한 없음/명시 없음,4학기 이상,명시 없음,약 25~30 ECTS,준도시 — 킬 도심까지 버스 약 15분,"독일어, 영어",독일어·영어 CEFR B1 이상 (일부 학과 B2~C1),유럽 한복판이라 주말 배낭여행 거점으로 최적 · 바다와 가까운 휴양 도시 분위기,GPA:시트 · 어학:시트 · 수업언어:시트 · 전공:시트 · 위치:AI추정,https://www.studium.uni-kiel.de/en/examinations/examination-procedure/general-information/the-grading-system,cau-exchange@uv.uni-kiel.de
GERMANY,Osnabruck University of Applied Sciences,모든 전공,Faculty of Business Management and Social Sciences,담당자 이메일 문의,제한 없음 (학부; 대학원 4학기),20 ECTS,32.5 ECTS,준도시 — 소도시 오스나브뤼크 시내 (하노버에서 기차 약 60분),"독일어, 영어",학부: 영어 B1·독일어 B2 이상 / 대학원: 영어 B2·독일어 B2 이상,기숙사 엘리베이터 미설치·버디 지원 · 하노버 접근성 좋은 조용한 대학 도시 · 독일 전통 건축물과 현대적 캠퍼스 조화,GPA:이메일문의 · 어학:시트 · 수업언어:시트 · 전공:시트 · 위치:AI추정,https://www.hs-osnabrueck.de/en/university/faculties/wiso/international/incoming/,incoming-overseas-wiso@hs-osnabrueck.de
GERMANY,Free University of Berlin,모든 전공,"대부분 학부 개방(의·약·법 제한), 자연과학/인문사회 B1/B2 권장",제한 없음/명시 없음,2학기 이상,명시 없음,제한 없음,준도시 — 베를린 도심까지 지하철 약 15분,"독일어, 영어",담당자 이메일 문의,유럽 한복판이라 주말 배낭여행 거점으로 최적 · 대도시라 인턴·문화생활 기회 풍부,GPA:시트 · 어학:이메일문의 · 수업언어:웹 · 전공:웹 · 위치:AI추정,Direct Exchange • Education • Freie Universität Berlin,incoming@fu-berlin.de
GERMANY,Ludwig Maximilian University of Munich,모든 전공,교환학생 수용하는 모든 학과,담당자 이메일 문의,3학기 이상,명시 없음,제한 없음,도시 — 뮌헨 도심에 위치,"독일어, 영어",독일어 CEFR B2 이상 (지원 시 B1); 영어강의만 수강 시 독일어 증명 불요,기숙사 및 민간 숙소 지원 · 유럽 한복판 주말 배낭여행 거점 · 미식·맥주 문화 중심 도시 · 알프스 접근성 좋은 대도시,GPA:이메일문의 · 어학:웹 · 수업언어:시트 · 전공:시트 · 위치:AI추정,www.lmu.de/en/international/incoming,lmuexchange-incoming@lmu.de
GERMANY,Furtwangen University,모든 전공,교환학생 수용하는 모든 학과,담당자 이메일 문의,4학기 이상,명시 없음,30 ECTS,준도시 — 소도시 푸르트방엔 시내 (프라이부르크에서 버스 및 기차 환승 약 45분),"독일어, 영어",영어 또는 독일어 CEFR B1 이상,"기숙사 비용 월 280~470유로, 1인 아파트 350유로 · 프라이부르크 접근성 좋은 소도시 생활 · 독일 블랙포레스트 휴양지 근접 · 실용적 공학 교육 중심 대학",GPA:이메일문의 · 어학:웹 · 수업언어:웹 · 전공:시트 · 위치:AI추정,Exchange students | International | Furtwangen University,incoming@hs-furtwangen.de
GERMANY,Frankfurt University of Applied Sciences,모든 전공,교환학생 수용하는 모든 학과,3.0/4.0,2학기 이상,20 ECTS,30~35 ECTS,준도시 — 프랑크푸르트암마인 도심까지 지하철 약 15분,"독일어, 영어",영어 CEFR B2 이상 (홈교 확인서 가능),유럽 주요 도시 접근성 뛰어난 교통 허브 · 프랑크푸르트 금융 중심지 인턴십 기회 풍부 · 현대적 캠퍼스·실용적 교육 환경,GPA:시트 · 어학:시트 · 수업언어:시트 · 전공:시트 · 위치:AI추정,https://www.frankfurt-university.de/en/studies/international-office/incomings/exchange/,incoming.exchange@io.fra-uas.de
GERMANY,Frankfurt School of Finance and Management,모든 전공,교환학생 수용하는 모든 학과,담당자 이메일 문의,"4학기 이상 (학부, 경영·경제 전공)",6 ECTS (1모듈),30 ECTS (5모듈),도시 — 프랑크푸르트암마인 도심에 위치,영어,TOEFL iBT 90점 이상 또는 IELTS 7.0점 이상 또는 PTE Academic,유럽 금융허브 도시에서의 인턴십 기회 풍부 · 프랑크푸르트 공항 접근성 우수한 교통 요충지 · 마인강변 산책로와 현대적 도시 풍경 조화,GPA:이메일문의 · 어학:시트 · 수업언어:시트 · 전공:시트 · 위치:AI추정,https://www.frankfurt-school.de/de/students-alumni/international-office,InternationalOffice@fs.de
GERMANY,Berlin School of Economics and Law,모든 전공,교환학생 수용하는 모든 학과,담당자 이메일 문의,제한 없음,10 ECTS,40 ECTS,도시 — 베를린 도심에 위치,영어,영어 CEFR B2 이상,기숙사 미보장·조기신청 필요 · 유럽 중심지로 주말 여행·인턴십 기회 다수 · 예술·역사 유적지 밀집한 문화 도시,GPA:이메일문의 · 어학:시트 · 수업언어:시트 · 전공:시트 · 위치:AI추정,https://www.hwr-berlin.de/en/study/international-study/exchange-students-at-the-hwr-berlin/organizing-your-studies-at-department-1,incoming@hwr-berlin.de
GERMANY,University of Bonn,모든 전공,모든 학과 개방(의·약 제외),3.0/4.0,1학기 이상,명시 없음 (권장 약 30 ECTS),명시 없음 (권장 약 30 ECTS),도시 — 본 도심에 위치,"독일어, 영어",영어 CEFR B2~C1·독일어 B2 이상,선택적 기숙사 제공 · 유럽 한복판 주말 배낭여행 거점 · 라인강변 고즈넉한 대학도시 낭만 · 미식과 카페 문화 발달한 도시,GPA:시트 · 어학:시트 · 수업언어:시트 · 전공:시트 · 위치:AI추정,https://www.uni-bonn.de/en/studying/international-students/exchange-students/global-exchange-program/global-exchange-program?set_language=en,globalexchange-incoming@uni-bonn.de
GERMANY,RWTH Aachen University,모든 전공,교환학생 수용하는 모든 학과,제한 없음/명시 없음,5학기 이상,15 ECTS,30 ECTS,도시 — 아헨 도심에 위치,"독일어, 영어",영어 또는 독일어 CEFR B1 이상,교내 기숙사 미보장·조기신청 필요 · 유럽 내 교통 허브로 주말 여행 편리 · 독일 전통 건축물과 현대적 캠퍼스 조화 · 미식과 맥주 문화로 유명한 도시,GPA:시트 · 어학:factsheet · 수업언어:factsheet · 전공:시트 · 위치:AI추정,https://www.wiwi.rwth-aachen.de/cms/wirtschaftswissenschaften/studium/Internationales/Exchange-Office/~icy/Incomings/,stefanie.spatafora@wiwi.rwth-aachen.de
GERMANY,Friedrich–Alexander University,공과대학,"교환학생 수용하는 모든 학과(공학·의학·자연과학 등), 단 학부별 언어 요건 확인 필요",담당자 이메일 문의,2학기 이상,확인필요,30 ECTS (권장),준도시 — 소도시 에를랑겐 시내 (뉘른베르크에서 기차 약 50분),"독일어, 영어",영어 CEFR B1~B2 또는 독일어 B1,기숙사 사실 미보장·개별 신청 필요 · 뉘른베르크 접근성 좋은 소도시 낭만 · 공학·의학 연구 인프라 우수 · 바이에른 전통 음식과 맥주 문화 체험,GPA:이메일문의 · 어학:시트 · 수업언어:웹 · 전공:시트 · 위치:AI추정,https://www.fau.eu/studying/international-students/students-on-exchange-programs/,mobility@fau.de
HONG KONG,The Chinese University of Hong Kong,모든 전공,교환학생 수용하는 모든 학과,Good standing (수치 기준 없음),2학기 이상,9 units,18 units,준도시 — 샤틴 도심까지 지하철 약 30분,영어,TOEFL iBT 80점 이상 (신척도 4.5) 또는 TOEFL PBT 550점 이상 또는 IELTS 6.0점 이상 (대학원 6.5),홍콩 섬과 가까운 자연 경관·트레킹 명소 · 미식·쇼핑·야경 즐길 수 있는 글로벌 도시 · 대학 내 중영 이중언어 환경·국제적 분위기,GPA:시트 · 어학:웹 · 수업언어:시트 · 전공:시트 · 위치:AI추정,https://www.oal.cuhk.edu.hk/campuslife/,claireli@cuhk.edu.hk
HONG KONG,The University of Hong Kong,모든 전공,"대부분 학부 개방(경영·법·인문·공학 등), 법·경영은 추가 요건",3.3/4.3 (법·경영 제외 전공은 3.0/4.0),2학기 이상,24~30 ECTS,36 ECTS,준도시 — 홍콩 도심까지 지하철 약 15분,영어,TOEFL iBT 97점 이상 또는 IELTS 7.0점 이상 (법대) 또는 TOEFL iBT 80점 이상 또는 IELTS 6.5점 이상 (기타),봄학기 기숙사 가용성 높음 · 아시아 금융허브 도시에서의 글로벌 인턴십 기회 · 미식과 야경 명소로 유명한 활기찬 도시 생활 · 홍콩 도심 접근성 좋은 현대적 캠퍼스 환경,GPA:웹 · 어학:웹 · 수업언어:웹 · 전공:웹 · 위치:AI추정,https://intlaffairs.hku.hk/exchange,exchange@hku.hk
HONG KONG,City University of Hong Kong,모든 전공,교환학생 수용하는 모든 학과,명시 없음 (법대만 3.0/4.3),2학기 이상,12 credits,18 credits,준도시 — 홍콩 도심까지 지하철 약 15분,영어,TOEFL iBT 79점 이상 또는 IELTS 6.5점 이상,미식과 카페 문화로 유명한 도시 · 시내로 나가는 대중교통 편리 · 대도시라 인턴·문화생활 기회 풍부,GPA:웹 · 어학:시트 · 수업언어:시트 · 전공:시트 · 위치:AI추정,https://www.cityu.edu.hk/geo/global-opportunities/student-exchange/inbound-student-exchange,phoebe.sung@cityu.edu.hk
HONG KONG,Hong Kong Polytechnic University,모든 전공,모든 학과 개방(경영/공학/건설환경/보건 등),2.7/4.0,2학기 이상 (1년),9 credits,18 credits,준도시 — 홍콩 도심까지 지하철 약 15분,영어,IELTS 6.0점 이상 또는 TOEFL iBT 80점 이상,미식과 카페 문화로 유명한 도시 · 대도시라 인턴·문화생활 기회 풍부,GPA:시트 · 어학:시트 · 수업언어:시트 · 전공:웹 · 위치:AI추정,https://www.polyu.edu.hk/geo/exchange-and-study-abroad/incoming-students/incoming-exchange/,inbound.exchange@polyu.edu.hk
HUNGARY,University of Pecs,모든 전공,교환학생 수용하는 모든 학과,2.5/4.0 (또는 3.5/5.0),2학기 이상,10 ECTS,30 ECTS,준도시 — 소도시 페치 시내 (부다페스트에서 기차 약 2시간),"헝가리어, 영어",영어 CEFR B2 이상,유럽 전통 건축물과 현대적 캠퍼스 조화 · 부다페스트 접근성 좋은 소도시 생활 · 헝가리 전통 온천 문화 체험 가능,GPA:시트 · 어학:시트 · 수업언어:웹 · 전공:시트 · 위치:AI추정,https://international.pte.hu/mobility-programs/erasmus,czeh.gabor@pte.hu
INDONESIA,Gadjah Mada University (UGM),모든 전공,교환학생 수용하는 모든 학과,3.0/4.0,2학기 이상,10 credits,18 credits,준도시 — 욕야카르타 도심까지 버스 약 15분,"인도네시아어, 영어",TOEFL 500점 이상 또는 IELTS 5.0점 이상 또는 TOEFL iBT 70점 이상 또는 TOEIC 500점 이상,유네스코 문화유산과 전통 시장 접근성 우수 · 열대 정원형 캠퍼스와 역사적 건축물 조화,GPA:시트 · 어학:시트 · 수업언어:웹 · 전공:시트 · 위치:AI추정,https://admission.ugm.ac.id/non-degree/student-exchange/,admission@ugm.ac.id
INDONESIA,University of Indonesia,경제대학/경영대학,교환학생 수용하는 모든 학과 개방,3.0/4.0,2학기 이상,명시 없음,15 credits,준도시 — 소도시 데폭 시내 (자카르타에서 버스 약 60분),"인도네시아어, 영어",TOEFL iBT 80점 이상 또는 TOEFL ITP/PBT 550점 이상 또는 IELTS 6.0점 이상,자카르타 접근성 좋은 휴양형 대학도시 · 열대 자연 속 현대적 캠퍼스 시설 · 인도네시아 전통문화 체험 기회 풍부,GPA:시트 · 어학:시트 · 수업언어:웹 · 전공:시트 · 위치:AI추정,https://international.ui.ac.id/exchange-program/,inbound@ui.ac.id
ITALY,University of Verona,모든 전공,교환학생 수용하는 모든 학과 개방,담당자 이메일 문의,2학기 이상,명시 없음,제한 없음,준도시 — 소도시 베로나 시내 (밀라노에서 기차 약 2시간),"이탈리아어, 영어",이탈리아어 또는 영어 CEFR B1 이상,로미오와 줄리엣 배경지·오페라 하우스 등 문화 자원 풍부 · 밀라노·베네치아 접근성 좋은 유럽 여행 거점 · 이탈리아 전통 미식 체험하기 좋은 소도시 분위기,GPA:이메일문의 · 어학:시트 · 수업언어:웹 · 전공:시트 · 위치:AI추정,https://www.univr.it/en/our-services/incoming-students-and-staff/exchange-students#doc_715,relazioni.internazionali@ateneo.univr.it
ITALY,Polytechnic University of Milan,"기계공학과 1명, 건축학과 2명",교환학생 수용하는 모든 학과,제한 없음/명시 없음,6학기 이상,명시 없음 (통상 30 ECTS),명시 없음 (통상 30 ECTS),준도시 — 밀라노 도심까지 지하철 약 15분,"이탈리아어, 영어",명시 없음,학생 기숙사 제공 · 밀라노 패션·디자인 산업 중심지 · 알프스·호수 접근성 좋은 여행 거점 · 유럽 최대 역사 중심가와 현대적 스카이라인 공존,GPA:시트 · 어학:시트 · 수업언어:웹 · 전공:시트 · 위치:AI추정,https://www.polimi.it/en/campus-e-servizi/international-mobility/study-abroad,exchange-leonardo@polimi.it
ITALY,Ca' Foscari University of Venice,모든 전공,교환학생 수용하는 모든 학과 개방,제한 없음/명시 없음,1학기 이상,홈교 기준,30 ECTS,준도시 — 베네치아 도심까지 버스 약 20분,"이탈리아어, 영어",TOEFL iBT 72점 이상 또는 IELTS 5.5점 이상 또는 PTE Academic 59점 이상,운하 도시 베네치아에서 낭만적인 유럽 생활 · 이탈리아 미식 문화 체험에 최적화된 도시 · 유럽 배낭여행 거점으로 접근성 우수,GPA:시트 · 어학:웹 · 수업언어:웹 · 전공:시트 · 위치:AI추정,https://www.unive.it/pag/12574/,incoming.mobility@unive.it
ITALY,Bocconi University,모든 전공,교환학생 수용하는 모든 학과,제한 없음/명시 없음,명시 없음,명시 없음 (최소 1과목),제한 없음 (최대 5과목),도시 — 밀라노 도심에 위치,"이탈리아어, 영어",명시 없음,기숙사 미보장·조기신청 필요 · 유럽 패션·금융 중심지 인턴십 기회 풍부 · 밀라노 명소 두오모·나빌리오 거리 접근성 우수 · 이탈리아 미식·카페 문화 체험 가능,GPA:시트 · 어학:시트 · 수업언어:웹 · 전공:시트 · 위치:AI추정,https://www.unibocconi.it/en/international-students/incoming-exchange-students,inexchange@unibocconi.it
JAPAN,Okayama University,모든 전공,"모든 학과 개방 (단, 석사생은 일본어 수업 및 영어 학부 과정만 수강 가능)",2.0/4.0,2학기 이상,10 credits,제한 없음,준도시 — 소도시 쓰시마 시내 (오카야마에서 버스와 기차 환승 약 120분),"일본어, 영어",TOEFL PBT 500점 이상 또는 TOEFL iBT 61점 이상 또는 IELTS 5.5점 이상,오카야마 성·코라쿠엔 정원 등 역사 명소 접근성 · 조용한 소도시 분위기로 학업 집중 환경 · 세토 내해 인접 휴양지 분위기,GPA:시트 · 어학:시트 · 수업언어:시트 · 전공:시트 · 위치:AI추정,https://intl.okayama-u.ac.jp/en/inbound/programs/epok/,epok-inbound1@adm.okayama-u.ac.jp
JAPAN,Daito Bunka University,모든 전공,교환학생 수용하는 모든 학과,제한 없음/명시 없음,2학기 이상,7 credits,제한 없음,준도시 — 소도시 히가시마쓰야마 중심까지 기차 약 100분 (도쿄에서 기차 약 60분),일본어,명시 없음,전통과 현대가 공존하는 독특한 캠퍼스 분위기 · 자연 속 조용한 학습 환경 · 도쿄 근교 접근성 좋은 휴양지,GPA:시트 · 어학:시트 · 수업언어:웹 · 전공:시트 · 위치:AI추정,https://www.daito.ac.jp/english/admissions/exchange.html,dbuexchange@jm.daito.ac.jp
JAPAN,Nishogakusha University,모든 전공,"학부·대학원 전 학과 개방(문학부, 국제정경학부, 글로벌일본학 등)",제한 없음/명시 없음,2학기 이상,명시 없음,제한 없음,도시 — 도쿄 도심에 위치,일본어,JLPT N2 이상,도쿄 중심가 접근성 우수한 교통 인프라 · 일본 전통문화 체험 가능한 신주쿠 인접,GPA:시트 · 어학:시트 · 수업언어:웹 · 전공:시트 · 위치:AI추정,https://www.nishogakusha-u.ac.jp/international/study_abroad_application.html,icenter1@nishogakusha-u.ac.jp
JAPAN,Aoyama Gakuin University,모든 전공,교환학생 수용하는 모든 학과 개방,2.5/4.0,1학기 이상,14 credits,제한 없음,도시 — 도쿄 도심에 위치,"일본어, 영어",TOEFL iBT 68점 이상 또는 IELTS 5.5점 이상 또는 JLPT N5 이상,기숙사·아파트·홈스테이 정보 핸드북 제공 · 도쿄 패션 중심지 신주쿠·하라주쿠 접근성 우수 · 일본 전통문화·현대문화 공존한 도시 분위기 · 미식·카페 문화 발달한 글로벌 도시,GPA:시트 · 어학:시트 · 수업언어:웹 · 전공:시트 · 위치:AI추정,https://www.aoyama.ac.jp/en/admission/exchange/,exchange@aoyamagakuin.jp
JAPAN,Fukuoka University,모든 전공,협정교 소속 학부 전공 분야 따라 개방,제한 없음/명시 없음,명시 없음,명시 없음,제한 없음,준도시 — 후쿠오카 도심까지 지하철 약 30분,일본어,JLPT N2 이상 (학부 과정) / N4~N3 (일본어·문화 과정),"교환학생 기숙사 보장 (국제교류회관, 전실 개인실) · 기숙사 비용: 입관비 33,000엔, 월 33,000엔 (광열비 별도) · 후쿠오카 미식·카페 문화 체험 가능 · 온천·자연 휴양지 접근성 우수 · 한국인에게 친근한 관광 도시 분위기",GPA:시트 · 어학:시트 · 수업언어:웹 · 전공:웹 · 위치:AI추정,https://www.kokusai.fukuoka-u.ac.jp/inbound/exchange_fgn/,kokusai@adm.fukuoka-u.ac.jp
JAPAN,Hitotsubashi University,모든 전공,"학부 5개 학부(경영/경제/법/사회과학/사회데이터과학) 개방, 대학원 7개 개방",2.7/4.0,4학기 이상,명시 없음,14 credits/쿼터 (28 credits/학기),준도시 — 소도시 코다이라 중심까지 기차 약 45분 (도쿄에서 기차 약 60분),"일본어, 영어",TOEFL iBT 79점 이상 또는 IELTS 6.0점 이상 또는 CEFR B2 이상 또는 JLPT N2 이상,"국제학생 기숙사(코다이라) 우선 배정, 1인실 공유형 · 사회과학 특화 도서관·연구 시설 우수 · 도쿄 접근성 좋은 조용한 자연 환경",GPA:웹 · 어학:웹 · 수업언어:웹 · 전공:웹 · 위치:AI추정,https://international.hit-u.ac.jp/en/pros/exchange/,edu-gs.g2@ad.hit-u.ac.jp
